Name,Day,Time,Video,Desc,Categories,Email,Phone
Eye Openers Online,Thursday,7:15 am,https://us02web.zoom.us/j/407807130,"Daily open meeting started over a year ago by Eye Openers home group in suburban New Orleans. Wednesdays read and discuss 12&12, topic and discussion all other days.  All are welcome.  Meets for one hour at 7:15am CT every day, indefinitely. No password required, waiting room enabled.  Attendance confirmations provided on request.","Audio,Discussion,Open,Telephone,Thursday,Video",nolaeyeopeners@gmail.com,3462487799
Serenity Now,Thursday,7:15 am,https://us02web.zoom.us/u/kehZ8zzolQ,Monday meetings focus on Literature: Reading and discussing from the 12&12 or Big Book. All other days a speaker chooses a topic to be discussed.,"Audio,Big Book,Closed,Discussion,Speaker,Telephone,Thursday,Video",815SerenityNow@gmail.com,
AA Downunder Meeting,Thursday,7:30 am,http://www.paltalk.com,"We are voice chat room for recovering alcoholics. It is a closed meeting and we have protocols that we follow, When you come in an admin will ask you to id yourself in IM. Please answer them. This way we try to keep it safe. We have over 80 members online and are still growing. Go to www.paltalk.com; get yourself a nic; and then go to health issues click on health then overcoming addictions.  IS THIS AM or PM Meeting?","Chat,Closed,Thursday",,
AAOnline Global Chat,Thursday,7:30 am,http://aaonline.org,Learn more about us at: aaonline.org,"Big Book,Chat,Discussion,Open,Speaker,Thursday",ttsoberalcoholic@aaonline.org,
Attitude Adjustment Group,Thursday,7:30 am,https://zoom.us/j/688841220,- Saturday: 12 Step discussion,"Audio,Closed,Telephone,Thursday,Video",crystallakestmarysaa@gmail.com,"13126266799,,688841220#"
"Happy, Joyous and Free",Thursday,7:30 am,https://us02web.zoom.us/j/2412241212,"+13126266799,,2412241212# US (Chicago)","Audio,Big Book,Discussion,Open,Thursday,Video",Happyaa164@gmail.com,
Joy of Living,Thursday,7:30 am,https://us02web.zoom.us/j/6243681507,joyoflifeaa.com,"Audio,Open,Thursday,Video",,
Morning Meetings,Thursday,7:30 am,https://us02web.zoom.us/j/88424327155,"Zoom Passcode, if any: email for password - morningmeetings88@gmail.com","Audio,Big Book,Closed,Discussion,Speaker,Telephone,Thursday,Video",morningmeetings88@gmail.com,"19292056099,,,,88424327155#,,,,,,0#,,508568#"
Never Alone Again,Thursday,7:30 am,http://www.neveralonegroup.org,"Please visit our website for details about the meeting, links to other meetings and to sign up as a speaker (90 days sobriety requested). We would love to hear from you.","Audio,Closed,Thursday,Video",neveraloneagaingroup@gmail.com,
Radical Maintenance,Thursday,7:30 am,,Telephone number 605-475-4821. Pin 757034#,"Audio,Closed,Telephone,Thursday",Radicalmaintenance@gmail.com,"4254366324,,757034#"
Crack of Dawn Online,Thursday,7:45 am,https://zoom.us/j/503970381,"Zoom Passcode, if any: dragon","Big Book,Discussion,Open,Speaker,Thursday,Video",aadragonsden@gmail.com,
Dawn Patrol,Thursday,7:45 am,https://us02web.zoom.us/j/405000945?pwd=LzB5WmVTWVZvUytLcURTNDllbTlhdz09,"Public Email Contact, if any: aadawnpatrolnm@gmail.com","Audio,Open,Thursday,Video",aadawnpatrolnm@gmail.com,
Sober Sunrise,Thursday,7:45 am,https://us04web.zoom.us/j/8417432452,"Zoom Passcode, if any: !Early645!","Big Book,Discussion,Open,Speaker,Thursday,Video",sobersunrisegroup@gmail.com,
AA Shillong Online Meetings,Thursday,8:00 am,https://us02web.zoom.us/j/5844564996,Find your local number: https://us02web.zoom.us/u/kc3brUP9L4,"Audio,Open,Thursday,Video",AAShillongOnlineMeetings@gmail.com,9436309256
Across the pond,Thursday,8:00 am,http://zoom.us/j/78646870969,"Open, Discuss, BB,Speaker all in no peticular order. Court verification and a mtg after the mtg.  Men with men woman with woman so it is a safe place to share.","Audio,Discussion,Open,Telephone,Thursday,Video",irenebblack@gmail.com,5208292638
Boozers in Bathrobes,Thursday,8:00 am,https://zoom.us/j/7383769517?pwd=dUhZSGhkalAzNUtCV2FyMXdrWHBuQT09,Pass code 505505,"Audio,Open,Thursday,Video",boozersinbathrobes@gmail.com,
Daily Reflections with Pride,Thursday,8:00 am,https://us02web.zoom.us/j/5223786676,"Zoom Passcode, if any: Please email DRwithPride@aol.com by 5pm ET for next day's Meeting Password.","Audio,LGBTQIAA+,Open,Thursday,Video",DRwithPride@aol.com,
Fight Club AA -- Early Bird Meeting,Thursday,8:00 am,https://us04web.zoom.us/j/7208952542,"Meeting Access Code, if any: code88","Audio,Discussion,Open,Thursday,Video",info@aablogger.com,"3107041405,,code88"
Get It Together (GIT),Thursday,8:00 am,https://us02web.zoom.us/j/278857237?pwd=Y3UyNjFkemk2YlJ3YVdYL24zckU0QT09,"Web Site, if any: http://chandleraa.com/","Audio,Discussion,Open,Telephone,Thursday,Video",admin@chandleraa.com,6699009128
Good Morning God,Thursday,8:00 am,,Once you have entered the meeting please press *6 to mute yourself. When we announce is sharing time you are welcomed to press *6 to unmute yourself.,"Audio,Open,Thursday",aamorningstogether@gmail.com,
Hair of The Dog Morning Meditation AA Meeting,Thursday,8:00 am,https://us02web.zoom.us/j/9681221958,The second Sunday Night of each month we hold our speaker meeting at 7:00pm PST.,"Audio,Discussion,Open,Telephone,Thursday,Video",whenweretireatnightaa@gmail.com,"13126266799,,,,9681221958#"
Middle of the Formation,Thursday,8:00 am,https://nyintergroup.zoom.us/j/9630316570,"This meeting is geared towards Veterans and First responders that are suffering from the disease of Alcoholism/Addiction. It a safe place for you to share your experiences, grief, and trauma.  All are welcome! You can leave your camera off if you wish to stay anonymous. The amount of stress must be overwhelming, just know we are here for you and you are in the right place!!!!!!!!!!!","Audio,Big Book,Discussion,Open,Speaker,Telephone,Thursday,Video,Young People",Middleoftheformation@aol.com,
Plane of Inspiration,Thursday,8:00 am,https://us02web.zoom.us/j/7725404263,http://spiritoftheuniverse.info,"Audio,Big Book,Discussion,Open,Thursday,Video",spiritoftheuniverse7@gmail.com,7052421130
Portland Eye Opener,Thursday,8:00 am,http://www.portlandeyeopener.com/WebMeetings.html,"We meet every day to stay sober and to facilitate the daily maintenance of our spiritual condition. Please join us at 6:00 a.m. Pacific Time. We have multiple meetings, large and small at different times and with different formats. Please visit our website for more info. http://www.portlandeyeopener.org/WebMeeting/","Open,Thursday,Video",PortlandEyeOpener@gmail.com,
Tropical open AA MEETING,Thursday,8:00 am,https://us02web.zoom.us/w/3822872050,"Meeting Access Code, if any: 101253","Discussion,Open,Thursday,Video",imsobernfree@gmail.com,13126266799
Wake Up,Thursday,8:00 am,https://us02web.zoom.us/j/82375395998,Passcode: 925387,"Big Book,Discussion,Open,Telephone,Thursday,Video",wakeupgrouplive@gmail.com,"12532158782,,,,82375395998#"
Worldwide Primary Purpose Group,Thursday,8:00 am,https://zoom.us/j/759556794?fbclid=IwAR1o3osJ_0e-3MEPtA9-nTVJzN1yH_wQIHTiFe5F3tdH3ippEpArXzFL8SA,"10:00 PM CST  12 & 12 - An in-depth  look at our other text, the 12 & 12","Audio,Closed,Thursday,Video,Women",wwppg@yahoo.com,
On Awakening,Thursday,8:30 am,https://us02web.zoom.us/j/2205979191,"Meeting Access Code, if any: 2mGN0C","Meditation,Open,Thursday,Video",step11pdx@gmail.com,"2205979191,,2mGN0C#"
PG & Chill,Thursday,8:30 am,https://us02web.zoom.us/j/802496652,Password 960328,"Audio,Open,Telephone,Thursday,Video",superdave1212@mac.com,"16699006833,,802496652"
Rocklin Fellowship 6:30 am Co-Ed Topic Meeting,Thursday,8:30 am,https://zoom.us/j/607503214,The password for all meetings is Rocklin.,"Discussion,Open,Thursday,Video",rocklinfwpaa@gmail.com,
Share What Works for You,Thursday,8:30 am,https://us02web.zoom.us/j/9795465211,https://sharewhatworksforyou.wordpress.com,"Open,Secular,Thursday,Video",sharewhatworksforyou@gmail.com,
Upland California Attitude Adjustment Meeting,Thursday,8:30 am,https://us02web.zoom.us/j/370763329,We're an open meeting where love and tolerance is our code while adhering to the 12 Traditions.  Out-of-area members are welcome.,"Big Book,Discussion,Open,Telephone,Thursday,Video",ivrsmorningmeeting@gmail.com,16699006833
Woodland Online Group,Thursday,8:30 am,https://aawoodland.org/virtual-meetings-woodland,Meeting ID: 250 567 582,"Audio,Big Book,Open,Speaker,Steps / Traditions,Thursday,Video",woodlandgrouponline@gmail.com,
1 Hole In The Sky AA Meetings: AA Spiritual Discussion,Thursday,8:45 am,https://zoom.us/j/705311870,Monday to Friday: AA Spiritual Discussion 6:45am PST - Meeting ID: 705-311-870,"Audio,Open,Thursday,Video",holeinthesky.zoom@gmail.com,
Paragraph Group,Thursday,8:45 am,https://us04web.zoom.us/j/401614940,"We use Zoom video conferencing, but people can also call-in to the meeting by telephone. The meeting is held 7 days a week from 8:45 am to 9:45 am Central Time. Everyone is welcome to attend! Experience, strength, and hope from Bowling Green, Kentucky","Audio,Discussion,Open,Telephone,Thursday,Video",susanne.anon.kentucky@gmail.com,"3017158592,,401 614 940"
11 Step Meditation,Thursday,9:00 am,https://us02web.zoom.us/j/5312148605?pwd=ajlUTlNmaHVjSmhEVExCQjd5dmVUUT09,This is a closed meeting.  Come by and join us for the meditation!,"Closed,Thursday,Video",cametobelievetampa@gmail.com,
7 & Sober,Thursday,9:00 am,https://us02web.zoom.us/j/198638083?pwd=K1NKWDBwbFVYeFJ1T2NJTDNtSWpEQT09,"Based in Bothell, WA USA","Big Book,Discussion,Open,Thursday,Video,Young People",7sober@gmail.com,
As Bill Sees It,Thursday,9:00 am,https://us02web.zoom.us/j/ 7926179050,Waiting Room is used/enabled,"Closed,Thursday,Video",ABSInewcomersCM@gmail.com,
As She Sees It,Thursday,9:00 am,https://us02web.zoom.us/j/4514784571?pwd=ZEVzZ2FsV3diUzNVRHI2VUozTGd4UT09,"Meeting Access Code, if any: badndabx","Audio,Closed,Discussion,Thursday,Video,Women",AsSheSeesItBx@gmail.com,
Capital City Group,Thursday,9:00 am,https://zoom.us/j/4864850129,"Zoom Passcode, if any: cc","Big Book,Discussion,Open,Thursday,Video",capitalcityaa@outlook.com,
Central Eastside Group (Saginaw),Thursday,9:00 am,http://aavideochat.com,One hour regular meeting,"Audio,Closed,Thursday,Video",saginawgeorge@gmail.com,
Freedom from Alcohol Group,Thursday,9:00 am,paltalk://group/3874453,paltalk://group/3874453,"Audio,Open,Thursday",,
Get up shut up in silent meditation,Thursday,9:00 am,https://us04web.zoom.us/j/4248226111,"No password required, waiting room enabled.","Open,Thursday,Video",gusuism@gmail.com,
GUSU 2 Get up Shut Up,Thursday,9:00 am,https://us02web.zoom.us/j/4248226111,On-Line Meeting link https://us02web.zoom.us/j/4248226111,"Open,Thursday,Video",gusuism@gmail.com,
Harlem Sober,Thursday,9:00 am,https://zoom.us/j/246420189,Meeting ID: 246 420 189,"Audio,Closed,Thursday,Video",District620meeting@gmail.com,
Nameless Bunch of Drunks International,Thursday,9:00 am,https://us02web.zoom.us/j/95067692981,"We were started by a group of drunks around Seattle, WA in February of 2020.  No password required - waiting room enabled.","Audio,Discussion,Open,Thursday,Video",,12532158782
Naples Men's Stag,Thursday,9:00 am,https://us02web.zoom.us/j/8549560860,Tuesday and Sundays BIg Book studies are from the 4th Addition,"Audio,Big Book,Closed,Discussion,Men,Telephone,Thursday,Video",Naplesmen@gmail.com,
Salerno Beach Head Crew,Thursday,9:00 am,https://us02web.zoom.us/j/6720988037?pwd=Q0VZMS8rdlVGbFZnU252RTV3NGpwQT09,Password: 889464,"Big Book,Discussion,Open,Speaker,Thursday,Video",salernobeachhead10am@gmail.com,
Serenity Circle,Thursday,9:00 am,https://us04web.zoom.us/j/904646389,"Location: We originate from Temecula, California (in SoCal)","Audio,Open,Thursday,Video",,
Sober Women United,Thursday,9:00 am,,"We are a fellowship of women who meet Monday, Wednesday, and Friday at 9:30 am EST. Our format includes 10 minutes of meditation followed by discussion of readings from either Daily Reflections, the Big Book, 12 & 12, other AA approved literature, The 24 Hour and Day Book, and topics. Call (605) 313-5974, Access Code 569562#","Audio,Closed,Telephone,Thursday,Women",soberwomenunited@gmail.com,"6053135974,,569562#"
SPIRIT of the Universe ~,Thursday,9:00 am,https://us02web.zoom.us/j/7725404263,"Zoom Passcode, if any: 123123","Big Book,Discussion,Speaker,Thursday,Video",spiritoftheuniverse7@gmail.com,7052421130
The Awakenings Group,Thursday,9:00 am,https://us02web.zoom.us/j/5406455899,"Zoom Passcode, if any: 449417","Big Book,Open,Thursday,Video",awakenings9am@gmail.com,
Wake Up World Wide,Thursday,9:00 am,http://zoom.us/j/4830135601,Password: 1111111,"Audio,Open,Thursday,Video",,
Waldport- Easy Does It,Thursday,9:00 am,https://us02web.zoom.us/j/483748921,Open discussion,"Discussion,Open,Thursday,Video",plantsaremylife@outlook.com,
Agneswater Literature Study 12.30 am Daily,Thursday,9:30 am,https://us02web.zoom.us/j/8983968244?pwd=bWc4eTlHV3RDVnZsdUdTVitadVc0QT09,"Zoom Passcode, if any: billw","Audio,Big Book,Discussion,Open,Thursday,Video",jlynch1967@hotmail.com,0435256092
Biarritz AA Group,Thursday,9:30 am,,Meetings = 60 mins Host = (Thursday Ilir T/ (Saturday Bruce B) + / Co-Host = TBD Speaker = 15-20 mins / Topic = speaker’s choice,"Audio,Open,Speaker,Thursday,Video",BABANGLOPHONEGROUP@GMAIL.COM,
Hout bay AA Cape Town South Africa,Thursday,9:30 am,https://us02web.zoom.us/j/326407254?pwd=C1cUEWO4YsA,Zoom Meeting ID: 326 407 254,"Audio,Open,Steps / Traditions,Thursday,Video",zigzagflower@rocketmail.com,
Recovery Journey,Thursday,9:30 am,http://secondlife.com/,barbara.j.knight@gmail.com,"Chat,Game,Open,Thursday",barbara.j.knight@gmail.com,
Start Your Day Right,Thursday,9:30 am,https://us04web.zoom.us/s/634162817,The in person meeting has resumed at the Vet Center in Santa Barbara.,"Audio,Open,Thursday,Video",sydr.sbaa@gmail.com,
AMAA (a.m. AA),Thursday,10:00 am,https://us02web.zoom.us/j/223055650?pwd=bFlNNHFiamZ5WCsrY0QyMFUrS0FlUT09,,"Open,Thursday,Video",,
An Alcoholic Like Me,Thursday,10:00 am,,the AA Big Book and share. Passcode 306633#,"Big Book,Closed,Discussion,Telephone,Thursday",,6053134434
Eastern Connecticut Sober Friends Morning,Thursday,10:00 am,https://us02web.zoom.us/j/726895753,"A daily Zoom meeting that reads and shares about the Daily Reflection. Open to all; everyone is welcome to attend. Meets at 11am EST daily, 7days a week, 1hr. No Password required; Waiting Room enabled","Open,Thursday,Video",easternctsoberfriends@gmail.com,
Put A Little Gratitude In Your Atttitude: Rotating Step / Speaker Meeting,Thursday,10:00 am,https://us02web.zoom.us/j/820704579,Please email for Passcode. We meet everyday at 11AM EST / 8AM PST,"Chat,LGBTQIAA+,Speaker,Thursday,Video",gratitude.attitude.group@gmail.com,
We stand together AA Big Book,Thursday,10:00 am,https://aaa-197.my.webex.com/aaa-197.my/j.php?MTID=md500d1c919e91a16499ea6089e10ca4e,We meet for 1 hour Monday through Saturday 11am we take turns reading from the big book for the first 30 minutes  then we open up the meeting for shares about what we read or what we are experiencing in our sobriety.  We use webex for the virtual meetings.,"Audio,Big Book,Closed,Thursday,Video",aawestandtogether@gmail.com,14156550001
What's Great?!,Thursday,10:00 am,https://us02web.zoom.us/j/865805045,"Public Email Contact, if any: anon4zoom@gmail.com","Audio,Closed,Thursday,Video,Women",anon4zoom@gmail.com,
Global Men's Meditation,Thursday,10:30 am,https://us02web.zoom.us/j/117348350?pwd=aC8wd0tadTlpTVpQQWFMWVZ1OU1odz09,Public Email Contact: kkcbmeetings@gmail.com,"Audio,Closed,Men,Thursday,Video",globalmensmeditation@gmail.com,
Just Before Noon,Thursday,10:30 am,https://us02web.zoom.us/j/78774014658,●    Friday- Open Celebration Meeting,"Big Book,Discussion,Open,Speaker,Thursday,Video",justbeforenoon@gmail.com,
Sioux Falls Southside,Thursday,10:30 am,https://zoom.us/j/631656365,"Public Email Contact, if any: harleymom10000@gmail.com","Big Book,Closed,Seniors,Thursday,Video",harleymom10000@gmail.com,
@12noon Key West AA Meeting,Thursday,11:00 am,https://us02web.zoom.us/j/87881197485?pwd=bWRMZVIzNXk0SDhYVmNCTjdBZ2hFQT09,Find your local number: https://us02web.zoom.us/u/kyg0gsOXj,"Audio,Closed,Telephone,Thursday,Video",kw12noongroup@gmail.com,"13017158592,,164662"
"1 Online 12 Step Recovery AA Newcomer Open Share 
(No Rules - Just Our Primary Purpose)",Thursday,11:00 am,https://zoom.com/j/3117908992,PASSWORD IS 13 IF REQUIRED,"Audio,Discussion,Open,Thursday,Video",online12steprecovery.com@gmail.com,
"1AA No Rules, Just Our Primary Purpose (Noon)",Thursday,11:00 am,https://zoom.us/j/3117908992,Password: 13,"Audio,Open,Telephone,Thursday,Video",casdorphd@gmail.com,"13462487799,,,,311790 8992#"
A secular meditation meeting,Thursday,11:00 am,https://us02web.zoom.us/j/82873883622?pwd=eEdiVU1KaHhzVGd0dGhWMmU1cmM4UT09,"Zoom Passcode, if any: 424242","Discussion,Open,Secular,Thursday,Video",secularmeditation.aa@gmail.com,16699006833
AA Meeting Online,Thursday,11:00 am,http://www.aameetingonline.com,Dial: 1-224-501-3412 and when prompted to enter Meeting Id# 445-854-373,"Audio,Closed,Telephone,Thursday,Video",bill@aameetingonline.com,"12245013412,,445-854-373"
AA Recovery Online Meetings,Thursday,11:00 am,https://us02web.zoom.us/j/4768760583?pwd=WVYwdGNjRzVsUmI1VWRGOUhOZFpyUT09,"Web Site, if any: http://www.aarecoveryonlinemeetings.com","Big Book,Closed,Discussion,Speaker,Thursday,Video",aarecoveryonlinemeetings@gmail.com,523221469354
Back Porch International,Thursday,11:00 am,https://us02web.zoom.us/j/301333449,All meetings have a discussion portion after the lead.,"Discussion,Open,Speaker,Thursday,Video",backporchint@gmail.com,
Belmar Noon Refugees,Thursday,11:00 am,https://zoom.us/j/9049564909,Topic Varies. Waiting room enabled.,"Open,Thursday,Video",belmarnoonrefugees@gmail.com,9292056099
Bookshop-Statler Step Meeting,Thursday,11:00 am,https://zoom.us/j/95277488159,"No passcode required, waiting room enabled.","Closed,Thursday,Video",bookshopstatler@gmail.com,
Daily Reprieve,Thursday,11:00 am,https://zoom.us/j/130788176,Email for Password: Familykrow1@yahoo.com,"Audio,Discussion,Open,Telephone,Thursday,Video",,
F.O.T.H.L.I.,Thursday,11:00 am,http://Freeconferencecall.com,Tech savy AAs can download the freeconferencecall.com app and use their data/wifi.,"Audio,Telephone,Thursday",f.o.t.h.l.i159@gmail.com,5089241277
Harmony Group,Thursday,11:00 am,https://us02web.zoom.us/j/8052348624,"Harmony Group online A.A. Zoom meetings - based in San Luis Obispo, California","Audio,Discussion,Open,Telephone,Thursday,Video",harmonygroupslo@gmail.com,14157629988
"Ithaca, NY Noon Brownbaggers",Thursday,11:00 am,https://zoom.us/j/4013485321,REQUIRES PASSWORD. EMAIL noonbrownbaggers@gmail.com FOR ACCESS,"Audio,Big Book,Closed,Steps / Traditions,Thursday,Video",noonbrownbaggers@gmail.com,
Kissimmee Downtown Online Group KDOG,Thursday,11:00 am,https://us04web.zoom.us/j/626000773,Meeting Access Code: 626000773,"Open,Thursday,Video",kissimmeeaa@gmail.com,
"Lunch Bunch Group  & Breakfast Bunch - Greeneville, TN",Thursday,11:00 am,https://zoom.us/j/114160580,Zoom Id#114160580,"Big Book,Discussion,Open,Thursday",glennkharley@gmail.com,
Misfits Meeting,Thursday,11:00 am,https://us02web.zoom.us/j/6711705329,Open Discussion No passcode required waiting room enabled.,"Audio,Discussion,Open,Telephone,Thursday,Video",misfitsmeeting@gmail.com,6711705329
Mom & Pop Shop,Thursday,11:00 am,https://us02web.zoom.us/j/89389919893,"Zoom Passcode, if any: AAvillage","Audio,Open,Thursday,Video",radfordhall4343@gmail.com,
Never Alone Again,Thursday,11:00 am,http://www.neveralonegroup.org,"Please visit our website for details about the meeting, links to other meetings and to sign up as a speaker (90 days sobriety requested). We would love to hear from you.","Audio,Closed,Thursday,Video",neveraloneagaingroup@gmail.com,
Noon Meeting Cromwell,Thursday,11:00 am,https://zoom.us/j/135791515,"Public Email Contact, if any: cromwellnoonaa@gmail.com","Audio,Discussion,Open,Speaker,Thursday,Video",cromwellnoonaa@gmail.com,
Noon Step Meeting,Thursday,11:00 am,https://zoom.us/j/7674659726,We have a speaker on the step of the day and then we break into small groups for more in-depth discussion.,"Audio,Open,Telephone,Thursday,Video",beacongroup164@gmail.com,
NYC/Oxford Exchange,Thursday,11:00 am,,Email for meeting information: oxfordnycexchangemeeting@Gmail.com,"Audio,Big Book,Open,Telephone,Thursday,Video",oxfordnycexchangemeeting@Gmail.com,
O.D.A.A.T.,Thursday,11:00 am,http://indianriveraa.org,Zoom ID 998 7512 9964 pw 63228,"Audio,Open,Speaker,Thursday,Video",indianriveraa@gmail.com,
One Day at a Time in CNY Woman's Meeting,Thursday,11:00 am,https://us02web.zoom.us/j/4594794411,Meeting ID: 459 479 4411 Passcode: 731508,"Audio,Discussion,Thursday,Video,Women",,"19294362866,,,,4594794411#"
Open Arms Group of A.A.,Thursday,11:00 am,https://us02web.zoom.us/j/872903800,Email for Password: openarmsaa2020@gmail.com,"Audio,Big Book,Open,Speaker,Thursday,Video",openarmsaa2020@gmail.com,
Open Arms Group of AA,Thursday,11:00 am,https://us02web.zoom.us/j/872903800,"Meeting Access Code, if any: 872 903 800","Audio,Big Book,Open,Speaker,Telephone,Thursday,Video",openarmsaa2020@gmail.com,
Pied Piper Online,Thursday,11:00 am,https://us02web.zoom.us/j/6607166941,Zoom ID: 660 716 6941,"Open,Thursday,Video",onlinepiedpiper@gmail.com,
Rebellion Dogs,Thursday,11:00 am,https://rebelliondogs7.wixsite.com/website,Meeting ID: 526-366-8039,"Closed,Men,Thursday,Video",rebelliondogs7@gmail.com,
Rocklin Fellowship 9:00 am Co-Ed Meditation Meeting,Thursday,11:00 am,https://zoom.us/j/977136843,The password for all meetings is Rocklin.,"Open,Thursday,Video",rocklinfwpaa@gmail.com,
Rockridge Fellowship Oakland 9 AM Pacific (Noon Eastern) Daily,Thursday,11:00 am,https://us02web.zoom.us/j/299112061,"Zoom Passcode, if any: 499003","Big Book,Discussion,Open,Speaker,Thursday,Video",oaklandrockridgefellowship@gmail.com,
Secular on Thursday,Thursday,11:00 am,https://zoom.us/j/956892388,"+16465588656,,956892388# US (New York)","Open,Secular,Telephone,Thursday,Video",,"16465588656,,956892388"
SPOT CHECK AA AT NOON,Thursday,11:00 am,https://us02web.zoom.us/j/89211288492,Meeting ID: 892 1128 8492 Passcode: 263254,"Audio,Big Book,Closed,Discussion,Speaker,Telephone,Thursday,Video,Young People",D.E.A.R.MENANDWOMEN@GMAIL.COM,"13017158592,,,,89211288492#,,,,*026839#"
Strange Paradox,Thursday,11:00 am,https://us02web.zoom.us/j/668064382,"Zoom Passcode, if any: 653069","Discussion,Open,Thursday,Video",strangeparadoxaa@gmail.com,
TGIF (Thank God I'm Free!),Thursday,11:00 am,https://us02web.zoom.us/j/87877153648?pwd=bzZQd055NGVaamlPL0dpNXVGTkZIUT09,"Public Email Contact, if any: debra.timothy@gmail.com","Audio,Open,Thursday,Video",debra.timothy@gmail.com,
The Best Years Of Our Lives,Thursday,11:00 am,https://zoom.us/meeting/78040716119,"Meeting Access Code, if any: 341209","Discussion,Open,Thursday,Video",picassomoon77@gmail.com,"3017158592,,341209"
THE BEST YEARS OF OUR LIVES GROUP OF AA,Thursday,11:00 am,https://zoom.us/j/78040716119,"Meets every Friday from 12:00pm to 1:00pm. This AA meeting is Open, Discussion and non-smoking. Yes, both men and women can attend.","Audio,Open,Telephone,Thursday,Video",picassomoon77@gmail.com,"13017158592,,78040716119#"
The Lunch Club,Thursday,11:00 am,https://us02web.zoom.us/j/83805394993?pwd=SFlyeS8xMTV3SUZCbHlWdmx3VHRzUT09,For any questions please email homeawayfromhomecov@gmail.com,"Closed,Discussion,Thursday,Video",homeawayfromhomecov@gmail.com,"17789072071,,83805394993#"
The Sunshine Group,Thursday,11:00 am,https://us04web.zoom.us/j/766151658?pwd=TDMvNzZlMVRUZjVra1hlWjF2NjFxdz09,Password: 486725,"Audio,Discussion,Open,Telephone,Thursday,Video",aathesunshinegroup@gmail.com,"16699009128,,,,766151658#,,,,*486725#"
Virus or no Virus - Noon,Thursday,11:00 am,https://us06web.zoom.us/j/281656895,"The topic can always be changed based on the desires of the members and we turn to a First Step meeting when a newcomer identifies. We read the Preamble, Steps, Traditions, and 9th Step Promises at the beginning of each meeting and close with chips, 7th tradition, announcements, and 12th tradition reminder, before closing in prayer.","Discussion,Open,Thursday,Video",virusornovirus@gmail.com,19292056099
Whiners and Moaners | 12&12 study group,Thursday,11:00 am,https://us02web.zoom.us/j/278722259,password: 4454damen,"Audio,Closed,Thursday,Video",WhinersandMoaners@gmail.com,
Woodland Online Group (Daily Reflections Tues. & Living Sober Thurs.),Thursday,11:00 am,https://us02web.zoom.us/j/76695230238,Public Email Contact: Woodlandonlinegroup@gmail.com,"Audio,Discussion,Open,Telephone,Thursday,Video",Woodlandonlinegroup@gmail.com,"16699009128,,76695230238#"
BBB - Beginners' Big Book Study,Thursday,11:30 am,https://us04web.zoom.us/j/6552526422?pwd=NU9waDVLQUJlVWIrb2FmOEZTUmR0Zz09,For information or password e-mail: bigbookforbeginners@gmail.com.,"Audio,Big Book,Open,Telephone,Thursday,Video",bigbookforbeginners@gmail.com,
Lunch Bunch,Thursday,11:30 am,https://us02web.zoom.us/j/81748734496,"We meet 7 days a week on zoom, Each day is a different theme.","Audio,Big Book,Discussion,Open,Speaker,Thursday,Video,Young People",rls1010@gmail.com,9546846290
On Awakening,Thursday,11:30 am,https://us02web.zoom.us/j/83066910537?pwd=T01aMmtTVUpzYjVRNG9TUHpmVVFoZz09,"Public Email Contact, if any: chair@on-awakening.org","Audio,Discussion,Open,Speaker,Telephone,Thursday,Video",,"12532158782,,83066910537#"
“Wildest Dreams” - AA 10:00am WOMENS meeting,Thursday,12:00 pm,https://us02web.zoom.us/j/9513310411,"Zoom Passcode, if any: 046423","Audio,Closed,Telephone,Thursday,Video,Women",wildestdreamsaa@gmail.com,"16699009128,,,,9513310411#,,,,*046423#"
"1 AA No Rules, No Drama, Just A Primary Purpose",Thursday,12:00 pm,https://us02web.zoom.us/j/76925189247?pwd=TTZhTFlaTGpCVmxlanlVWEt1UGxWZz09,No passcode required waiting room enabled.,"Audio,Discussion,Open,Thursday,Video",nornodjpp@gmail.com,3372519562
