Name,Day,Time,Video,Desc,Categories,Email,Phone
AAOL - Alcoholics Anonymous On Line,Sunday,9:00 pm,,PLEASE EMAIL aanonol2020@gmail.com FOR LOG IN INFORMATION!,"LGBTQIAA+,Open,Sunday,Video",aanonol2020@gmail.com,
Back to Basics,Sunday,9:00 pm,https://us02web.zoom.us/j/3622583567?pwd=SWplZWlnVjI1MzVDTng1SGgycWI2dz09,"Meeting Access Code, if any: 1801","Audio,Big Book,Closed,Discussion,Sunday,Telephone,Video",backtobasicsaameeting@gmail.com,"13462487799,,1801#"
Chico New Life,Sunday,9:00 pm,https://zoom.us/j/289187546,Chico New Life Group meets via Zoom every Sunday from 7pm-8:15pm.  It is a speaker discussion meeting.,"Audio,Open,Sunday,Video",caseydiphone@gmail.com,
Decompression Chamber,Sunday,9:00 pm,https://us02web.zoom.us/j/3012613087?pwd=skVZOVRply9uVOdja2FBaGpjZGhOZz09,"Zoom Passcode, if any: sober","Discussion,Speaker,Sunday,Video",aadecompressionchamber@gmail.com,
Gay Meetings Nightly,Sunday,9:00 pm,https://www.gaymeetings.org,"An easy way to remember our meeting phone number, +1 (732) 352-3437, is that it spells ""READ LADIES"" on your phone's keypad. No meeting number or password is necessary—just dial and you will be connected.","Big Book,Closed,Discussion,LGBTQIAA+,Sunday,Telephone",gaymeetings@yahoo.com,17323523437
Modem to Modem Philadelphia,Sunday,9:00 pm,https://us02web.zoom.us/j/82654384990,Thursday- 12 & 12 Study,"Audio,Discussion,Open,Speaker,Sunday,Telephone,Video",modemtomodem164@gmail.com,"6465588656,,82654384990#"
Pee\Dee AA,Sunday,9:00 pm,https://us04web.zoom.us/j/442521837,Open Discussion Meeting,"Audio,Big Book,Open,Sunday,Video",windgapranch@gmail.com,
Rocklin Fellowship 7:00 pm Newcomer's Meeting,Sunday,9:00 pm,https://zoom.us/j/650793486,The password for all meetings is Rocklin.,"Discussion,Open,Sunday,Video",rocklinfwpaa@gmail.com,
Sober Voices Group,Sunday,9:00 pm,https://sites.google.com/site/aatelephonemeetings/home,"Sober Voices does not accept anonymous callers, use *82 to display your phone number.","Audio,Open,Sunday",aatelephonemeetings@gmail.com,
Sobriety at night,Sunday,9:00 pm,https://us02web.zoom.us/j/2012281985,All Are Welcome Beginners Topic Format Everyone Shares. Meeting Starts At 10:00 pm Eastern Time 7 Nights A Week,"Audio,Open,Sunday,Video",sober.nights.nyc@gmail.com,
Spark of Hope,Sunday,9:00 pm,http://zoom.us/j/6411641641,Call in by dialing +16699006833 or +14087403766 and punch in the info above,"Audio,Closed,Sunday,Telephone,Video",sparkofhope164@gmail.com,16699006833
SPIRIT of the Universe,Sunday,9:00 pm,https://us02web.zoom.us/j/77254042633,Passcode: 123123,"Big Book,Chat,Discussion,Email,Speaker,Sunday,Telephone,Video",spiritoftheuniverse7@gmail.com,7052421130
Vegas Drama Queens,Sunday,9:00 pm,https://us04web.zoom.us/j/410592740,"ZOOM into our daily women's meeting, format varies daily","Audio,Discussion,Open,Sunday,Video,Women",zoomintoaa@gmail.com,
"Where there is a Will, there is a Way.",Sunday,9:00 pm,http://zoom.us/j/354054276,"Meeting Access Code, if any: 354 054 276","Audio,Big Book,Discussion,Open,Sunday,Telephone,Video",wherethereisawillthereisawayaa@gmail.com,"3854956261,,354054276#"
Women’s Nightly Book Study,Sunday,9:00 pm,,Dial Telephone number (425) 436-6350   once prompted dial access code 770067# and you will be added to the conference call. After in conference Callers mute and unmute themselves by dialing *6,"Big Book,Closed,Sunday,Telephone,Women",womensaabookstudy@gmail.com,"4254366350,,770067#"
10TH Step at 10:10 Group,Sunday,9:10 pm,https://us02web.zoom.us/j/911097244,Meeting ID: 911 097 244,"Audio,Deaf / Hard of Hearing,Sunday,Telephone,Video",tenthatten@gmail.com,"13017158592,,,,911097244#"
AA Off Broadway Beginners Group of Alcoholics Anonymous,Sunday,9:30 pm,https://us02web.zoom.us/j/73324728771?pwd=TTRtaHVIbXptNGtqTmVUbzl3K0Mrdz09,Passcode for dial in only: 394110562,"Audio,Discussion,Open,Sunday,Telephone,Video",Offbroadwayaa@gmail.com,"16699006833,,394110562"
Sober and Chill,Sunday,9:30 pm,https://us02web.zoom.us/j/8909710901,"This is an open meeting of Alcoholics Anonymous that meets every Sunday at 10:30 pm EST/ 7:30pm CA Pacific time. This meeting follows a speaker/discussion format and, after the speaker, people are asked to limit shares to 3 minutes. All are welcome, disrespect will not be tolerated.","Discussion,Open,Speaker,Sunday,Video",soberandchill2021@gmail.com,
Twilight Zone,Sunday,9:30 pm,https://us02web.zoom.us/j/224420335,"Public Email Contact, if any: twilightzonemeeting@gmail.com","Audio,Discussion,Open,Speaker,Sunday,Video",twilightzonemeeting@gmail.com,
164 and Beyond - Online Meeting,Sunday,10:00 pm,https://zoom.us/j/6775677559,Zoom Meeting ID: 677 567 7559,"Closed,Sunday,Video",remotecommunities40@gmail.com,
AA After Hours,Sunday,10:00 pm,https://us02web.zoom.us/j/2478907316,Email for a password: AHPword@gmail.com,"Open,Sunday,Video",ahpword@gmail.com,
AA Grant Us The Serenity (GUTS) - Sunday,Sunday,10:00 pm,https://zoom.us/j/3726634285?pwd=VHVsMXBIY2d4RzczMTZJODk2YXpWdz09,"Web Site, if any: https://www.aaguts.com","Audio,Big Book,Discussion,Open,Sunday,Telephone,Video",room@aaguts.com,2532158782
AA-Alive,Sunday,10:00 pm,http://www.aa-alive.net/,Please note:  We do not verify attendance at meetings,"Chat,Discussion,Open,Steps / Traditions,Sunday",Info@aa-alive.org,
Grant Me The Wisdom,Sunday,10:00 pm,https://us02web.zoom.us/j/86412452672,Password: 632524,"Big Book,Discussion,Open,Sunday,Video",Grantmethewisdom2021@gmail.com,
Hour 22,Sunday,10:00 pm,https://us02web.zoom.us/j/89364734158,Meetings begin with a topic brought from any conference-approved AA Literature. The host will call on people for sharing. Shares are 3 minutes. Please limit your sharing to your experience with alcoholism as it relates to the topic of the meeting. All voices are welcome here.,"Big Book,Discussion,Open,Sunday,Video",hour22atx@gmail.com,
Moral Inventory,Sunday,10:00 pm,,This meeting works well for travelers and the two separate meetings in one day allow for room to mindfully meditate inbetween. There is no leader at this meeting.,"Audio,Closed,Sunday,Telephone",maryheal33@gmail.com,"6417150861,,550593"
Recovery Journey,Sunday,10:00 pm,http://secondlife.com/,barbara.j.knight@gmail.com,"Chat,Game,Open,Sunday",barbara.j.knight@gmail.com,
The Lopsided Triangle Group,Sunday,10:00 pm,https://zoom.us/j/800225716?pwd=NFpWZis4cnNZcFBXR0RjUVhJNDlaZz09,(Chicago) +1 929 205 6099 US (New York) Meeting ID: 800 225 716 Password: 734469,"ASL,Audio,LGBTQIAA+,Open,Speaker,Sunday,Telephone,Video,Young People",thelopsidedtrianglegroup@gmail.com,"800225716,,3legacies"
THERE IS A SOLUTION,Sunday,10:00 pm,https://zoom.us/j/251046515,"Zoom Passcode, if any: 031509","Big Book,Discussion,Open,Speaker,Sunday,Video",thereisasolutionaa1@gmail.com,6465687788
Waitsburg AA,Sunday,10:00 pm,https://zoom.us/j/488421504?pwd=SkJodFhjZHJBdHh0TEhlRkl0UGtwdz09,"We are a zoom group from the small town of Waitsburg Washington, USA.  Most of our members have over 20 years of sobriety (some over 40), but we are always looking for new folks to which we can pass on some of our wisdom, and who can help us remember ""what it was like"".  Join us most nights at 8pm Pacific.","Audio,Discussion,Open,Sunday,Video",info@waitsburgaa.com,
Worldwide Primary Purpose Group,Sunday,10:00 pm,https://zoom.us/j/759556794?fbclid=IwAR1o3osJ_0e-3MEPtA9-nTVJzN1yH_wQIHTiFe5F3tdH3ippEpArXzFL8SA,"10:00 PM CST  12 & 12 - An in-depth  look at our other text, the 12 & 12","Audio,Closed,Sunday,Video,Women",wwppg@yahoo.com,
A Chapter for The Agnostic,Sunday,10:30 pm,https://us02web.zoom.us/j/9116680204?pwd=VnBwQWI2UW8vRlRsVHFiNTJPbEJVUT09,"Zoom Passcode, if any: tolerance","Discussion,Forum,Open,Sunday,Video",radfordhall4343@gmail.com,
A Meeting Called ...,Sunday,10:30 pm,https://us02web.zoom.us/j/76041185632,LGBTQIA+ Speaker/Participation,"Audio,LGBTQIAA+,Open,Sunday,Telephone,Video",laurasunday2020@gmail.com,"13126266799,,76041185632#"
Sober AF,Sunday,10:30 pm,https://us02web.zoom.us/j/84752821258,No password. Waiting room enabled.,"Audio,Open,Sunday,Video",soberaf209@gmail.com,
Sobriety at night,Sunday,10:30 pm,https://us02web.zoom.us/j/2012281985,Open To All Sobriety At Night Meets 7 Nights At 11:30 pm Eastern Time,"Audio,Open,Sunday,Video",sober.nights.nyc@gmail.com,
The 4th Dimension Group of Alcoholics Anonymous,Sunday,10:30 pm,https://us05web.zoom.us/j/87059714652,Zoom Passcode is: Driars,"Audio,Big Book,Open,Speaker,Sunday,Video",reno4thdimension@gmail.com,
Vegas Quarantined,Sunday,10:30 pm,https://us04web.zoom.us/j/699516064,around the world,"Audio,Discussion,Open,Sunday,Video",zoomintoaa@gmail.com,
9pm Nightly Discussion Meeting,Sunday,11:00 pm,https://us02web.zoom.us/j/815892671266,Friday—Open Discussion,"Big Book,Deaf / Hard of Hearing,Discussion,LGBTQIAA+,Open,Sunday,Video",nightlydiscussionaa@gmail.com,
AA After Hours,Sunday,11:00 pm,https://us02web.zoom.us/j/2478907316,Email for a password: AHPword@gmail.com,"Open,Sunday,Video",ahpword@gmail.com,
AA Grant Us The Serenity (GUTS) - Sunday,Sunday,11:00 pm,https://zoom.us/j/3726634285?pwd=VHVsMXBIY2d4RzczMTZJODk2YXpWdz09,"Web Site, if any: https://www.aaguts.com","Audio,Big Book,Discussion,Open,Sunday,Telephone,Video",room@aaguts.com,2532158782
"BBG Promises
Candlelight Open Participation",Sunday,11:00 pm,,only): 566938,"Audio,Open,Sunday,Telephone,Video",thebbgaa@gmail.com,6699006833
CROSS TALK GROUP,Sunday,11:00 pm,,Passcode: 979634#,"Audio,Open,Sunday,Telephone",peter@coolasstuff.com,"7124510235,,979634#"
Crosstalk Meeting of AA,Sunday,11:00 pm,http://www.freeconferencecall.com/wall/bftgog1986/,Sun PM / Mon AM: Daily Reflections,"Audio,Big Book,Blind / Visually Impaired,Discussion,Open,Speaker,Sunday,Telephone",aa.crosstalk.mtg@gmail.com,"7124510235,,,,979634#"
Lambda Dallas AA Children of the Corn Meeting,Sunday,11:00 pm,https://zoom.us/j/827282878,https://lambdadallas.org/,"Closed,Discussion,LGBTQIAA+,Sunday,Video",,
"No Fees, No Dues",Sunday,11:00 pm,https://meet.jit.si/247recovery,"It is encouraged that a structured meeting begins 3 times a day, at 0700, 1500 and 2300. The meeting before the meeting and after the meeting can expand to fill the day :)","Audio,Closed,Sunday,Telephone,Video",nofeesnodues@gmail.com,
Principles Before Pandemic (Pb4P),Sunday,11:00 pm,https://us02web.zoom.us/j/94496270330,Email Principlesbe4pandemic@gmail.com for password.,"Audio,Closed,Discussion,Speaker,Sunday,Video",Principlesbe4pandemic@gmail.com,
SERENITY~LIVES~MATTER,Sunday,11:00 pm,https://us04web.zoom.us/j/79627919344,"Zoom Passcode, if any: SLM","Big Book,Discussion,Open,Sunday,Video",SERENITYLIVESMATTER@OUTLOOK.COM,7703224343
When We Retire At Night,Sunday,11:00 pm,https://zoom.us/j/954469573,Zoom: https://us02web.zoom.us/j/954469573,"Audio,Open,Sunday,Video",whenweretireatnightaa@gmail.com,
11:11 Candlelight Meeting,Sunday,11:11 pm,https://www.1111candlelight.org/,"Come join us for a relaxing end to your day at the 11:11 Candlelight Meeting.  We meet every night so come join us as we share our experience, strength & hope with one another!  All are welcome!  We open the meeting early & stay late for fellowship & laughter.","Discussion,Open,Sunday,Video",Candlelightmeeting2020@gmail.com,
AA - Thailand Sobriety Group Online,Monday,12:00 am,https://us04web.zoom.us/j/984312014,Sunday: Living Sober Reading w/ Discussion,"Audio,Discussion,Monday,Open,Video",aabrconline@gmail.com,
AA Grant Us The Serenity (GUTS) - Sunday,Monday,12:00 am,https://zoom.us/j/3726634285?pwd=VHVsMXBIY2d4RzczMTZJODk2YXpWdz09,"Web Site, if any: https://www.aaguts.com","Audio,Big Book,Discussion,Monday,Open,Telephone,Video",room@aaguts.com,2532158782
An all night place,Monday,12:00 am,https://us02web.zoom.us/j/2021096262,PW: Rule62,"Audio,Monday,Open,Secular,Video",anallnightplace@gmail.com,
LAST CALL,Monday,12:00 am,https://us02web.zoom.us/j/84274705712?pwd=clBzL0NVb1FySUVrSzkxcVY1RVJKdz09,This meeting occurs nightly @ 10pm PST,"Discussion,Monday,Open,Speaker,Video",lastcall@gmail.com,16699009128
Last stop,Monday,12:00 am,https://us04web.zoom.us/j/3954623725,Late night meeting for alcoholics that are up late at night. Email for password: Masterjs528@hotmail.com,"Monday,Open,Video",Masterjs528@hotmail.com,
Radford Zombies,Monday,12:00 am,https://us04web.zoom.us/j/2835953698,http://radfordonline.com,"Audio,Discussion,Monday,Open,Speaker,Video",radfordhall4343@gmail.com,
The Acid Test,Monday,12:00 am,https://zoom.us/j/537542397,"Meeting times are 12 noon, 6:00 pm and 10:00 pm MST (Phoenix AZ time). Please note that Arizona does not observe daylight savings time, so between March 14th and November 7th 2021, Arizona is on PST","Audio,LGBTQIAA+,Monday,Open,Video",AAAcidTest@gmail.com,16699009128
The Unshakable Foundation,Monday,12:00 am,https://us02web.zoom.us/j/8062584353,Open online meeting of Alcoholics Anonymous. Nightly at 10pm pacific time. One hour long topic meeting. Waiting room enabled.,"Audio,Big Book,Discussion,Monday,Open,Telephone,Video",theunshakablefoundation@gmail.com,3126266799
VEGAS Deliver us From Ego,Monday,12:00 am,https://nyintergroup.zoom.us/j/576015340,Public contact email zoomintoaa@gmail.com,"Audio,Monday,Open,Video",zoomintoaa@gmail.com,
Ohua Group,Monday,12:30 am,https://us02web.zoom.us/j/388665002,Sun = 7:30 PM (HST) - Big Book Study,"Audio,LGBTQIAA+,Monday,Open,Video",ohuagroup@gmail.com,6999006833
AA Daily Meditation Meeting,Monday,1:00 am,https://us04web.zoom.us/j/4706538587#success,"Web Site, if any: http://www.aageneva.org/","Closed,Meditation,Monday,Video",aadailymeditation@gmail.com,
AA Grant Us The Serenity (GUTS) - Sunday,Monday,1:00 am,https://zoom.us/j/3726634285?pwd=VHVsMXBIY2d4RzczMTZJODk2YXpWdz09,"Web Site, if any: https://www.aaguts.com","Audio,Big Book,Discussion,Monday,Open,Telephone,Video",room@aaguts.com,2532158782
Hawaii AA Ohana,Monday,1:00 am,https://us02web.zoom.us/j/2839146879,"Meeting Access Code, if any: 283 914 6879","Closed,Discussion,Monday,Speaker,Video",hawaiiaaohana@gmail.com,"8084219764,,2839146879#"
A.A. GRUPO 4 DE ABRIL,Monday,2:00 am,https://us02web.zoom.us/j/5553928271,SALA DE ESPERA HABITADA ..,"Audio,Big Book,Closed,Discussion,Monday,Open,Speaker,Video",grupocuatrodeabril@gmail.com,5107763176
AA 24 Godziny,Monday,2:00 am,,PW: Coffee,"Audio,Closed,Monday,Video",AA_24hours-owner@yahoogroups.com,
AA Grant Us The Serenity (GUTS) - Monday,Monday,2:00 am,https://zoom.us/j/3726634285?pwd=VHVsMXBIY2d4RzczMTZJODk2YXpWdz09,"Web Site, if any: https://www.aaguts.com","Audio,Big Book,Discussion,Monday,Open,Telephone,Video",room@aaguts.com,2532158782
Midnight Howlers of San Diego,Monday,2:00 am,https://us02web.zoom.us/j/6663059874?pwd=REFpS2dLM2tIcGtEUXpHcjFvUFRZQT09,We ask that you support & respect others in the meeting. We look forward to meeting you as we zoom the road of happy destiny! Court Verification requests can be sent to midnighthowlerssd@gmail.com,"Big Book,Discussion,Monday,Open,Video",midnighthowlerssd@gmail.com,
Recovery in da House,Monday,2:00 am,https://zoom.us/j/8784692945,"Meeting Access Code, if any: staysober","Big Book,Closed,Discussion,Monday,Video",recoveryindahouse@gmail.com,
Vegas PANDEMIC! at the disco,Monday,2:00 am,https://us04web.zoom.us/j/722570166,"rotating through daily reflections, burning desires and various meditations.","Audio,Discussion,Monday,Open,Video",zoomintoaa@gmail.com,
AA Grant Us The Serenity (GUTS) - Monday,Monday,3:00 am,https://zoom.us/j/3726634285?pwd=VHVsMXBIY2d4RzczMTZJODk2YXpWdz09,"Web Site, if any: https://www.aaguts.com","Audio,Big Book,Discussion,Monday,Open,Telephone,Video",room@aaguts.com,2532158782
Agneswater Bigbook Study or Topic,Monday,3:00 am,,"Zoom Passcode, if any: billw","Audio,Big Book,Chat,Discussion,Monday,Open,Video",jlynch1967@hotmail.com,
On Awakening (from the UK),Monday,3:00 am,https://us02web.zoom.us/j/86817851815,"Meeting Access Code, if any: awaken","Audio,Monday,Open,Telephone,Video",onawakening@bluestripe.net,
Shivering Denizens Daily Insomniac,Monday,3:00 am,https://us02web.zoom.us/j/87232950952,"Zoom Passcode, if any: 151","Audio,Monday,Open,Video",shivdenaa@gmail.com,
Sydney Inner West AA,Monday,3:30 am,https://utsmeet.zoom.us/j/86333944183,"Zoom Passcode, if any: 527611","Audio,Big Book,Monday,Open,Video",annandaleid@gmail.com,
Get up shut up in silent meditation,Monday,4:00 am,https://us04web.zoom.us/j/4248226111,"No password required, waiting room enabled.","Monday,Open,Video",gusuism@gmail.com,
GUSU 1 Get Up Shut Up,Monday,4:00 am,https://us02web.zoom.us/j/4248226111,"International Silent Meditation meeting of Alcoholics Anonymous open to all where we hope through readings, a twenty minute meditation and fellowship to expand our conscious contact with God, realise a greater freedom from the bondage of self and share emotional sobriety.","Monday,Open,Video",gusuism@gmail.com,
Southern Cross AA Group,Monday,4:00 am,http://www.southerncrossaa.blogspot.com,"8pm daily (Sydney, Australia, time zone) on PalTalk: select the Southern Cross AA Meeting Group Group to join.","Monday,Open,Video",janishirst@gmail.com,
Fourth Dimension Prayer & Meditation AA,Monday,4:15 am,https://us04web.zoom.us/j/89136475364,https://fourthdimensionaa.weebly.com,"Audio,Closed,Discussion,Meditation,Monday,Video",4thdimensionmtg@gmail.com,
@ AA Aussie Recovery,Monday,4:30 am,https://aaaussieaa.wixsite.com/skype,Email - brianedwardo@gmail.com,"Audio,Monday,Open,Video",brianedwardo@gmail.com,
AA-12 Step Daily Workout,Monday,5:00 am,https://us02web.zoom.us/j/6188402098,Eastern Standard Time,"Big Book,Closed,Monday,Video",AADaily12StepWorkout@gmail.com,
Crazy Monkey AA Group,Monday,5:00 am,https://zoom.us/j/87594927269,"Meeting Access Code, bahalana","Discussion,Monday,Open,Video",,
AA-Australia Unity Recovery Group,Monday,5:30 am,https://www.aa-oztralia.net,"9:30pm daily (Sydney, Australia, time zone) on PalTalk: to join find and select the AA-Australia Unity Recovery Group.","Audio,Monday,Open,Video",,
Elk Grove Fellowship - 11th Step,Monday,5:30 am,https://zoom.us/j/492336788,Morning Meditation meeting. No password required - waiting room enabled.,"Audio,Monday,Open,Telephone,Video",egfmeeting@gmail.com,"6699006833,,,,492336788"
NY / NJ Early Risers,Monday,5:30 am,https://us02web.zoom.us/j/385999144,Passcode: 11224,"Audio,Big Book,Discussion,Monday,Open,Video",nynjearlyrisers@gmail.com,
Sober Start,Monday,5:30 am,https://us02web.zoom.us/j/82515305518?pwd=TXYvV3pMdVhRRHlUQ3FBa2ZaN1pTZz09,"Public Email Contact, if any: soberstartsc@gmail.com","Big Book,Closed,Discussion,Monday,Open,Speaker,Video",soberstartsc@gmail.com,
Sunrise Serenity,Monday,5:30 am,https://us04web.zoom.us/j/632505540,Meeting ID: 632 505 540,"Audio,Discussion,Monday,Open,Video",aabillwzz@gmail.com,
Sunrise Sobriety,Monday,5:30 am,https://us02web.zoom.us/j/6594524780,Sat for a Big Book meeting,"Audio,Closed,Monday,Telephone,Video",sunrise.sobriety1@gmail.com,6468769923
Morning Meditation,Monday,5:45 am,https://us02web.zoom.us/j/718456934,Zoom ID:  718 456 934,"Audio,Closed,Discussion,Monday,Video",,
Big Book Step Study Meeting (India),Monday,6:00 am,https://meet.google.com/wdj-ghza-yuv,Big Book Study group,"Audio,Big Book,Monday",bigbookstudy21@gmail.com,917875872077
Bozos on the Bus,Monday,6:00 am,https://us05web.zoom.us/j/9345585022?pwd=OUlWcnRGSFRTelVvdlN0ajBlWmp5Zz09,Wednesdays – Emotional Sobriety reading and discussion.,"Closed,Monday,Video",bozosonthebus1@gmail.com,
Columbus Serenity Web Group,Monday,6:00 am,http://columbusserenity.com/,Columbus Serenity Web Groups meetings are rotating format meetings using Zoom chat and phone call in. Follow the link (https://www.ColumbusSerenity.org) to find meeting joining information.,"Audio,Closed,Monday,Video",cgcmh1@gmail.com,
Dawn Patrol On-Line,Monday,6:00 am,https://us02web.zoom.us/j/85499148139,Zoom Meeting ID 854-9914-8139; Password 563826,"Audio,Monday,Open,Telephone,Video",Dpatrolinfo@gmail.com,13017158592
Day Opener's Online,Monday,6:00 am,https://us02web.zoom.us/j/86562427482,Meeting ID: 865 6242 7482,"Audio,Big Book,Discussion,Monday,Open,Speaker,Video",aleesali0311@gmail.com,"13017158592,,86562427482#"
Day Openers Group,Monday,6:00 am,https://us02web.zoom.us/j/84646826412,Passcode: stay,"Audio,Monday,Open,Video",dayopenersgrp@gmail.com,
Early Risers,Monday,6:00 am,https://zoom.us/j/954967674?pwd=Ny9KcTZDSDdLcDVabjdxWlJieTNyZz09&fbclid=IwAR0q56I27Je-BmqJb_pYv-U2Lgp8fiG280ezoc84_k98YtPZqRn3RFoz_o0,All are welcome!,"Audio,Monday,Open,Video",earlyrisershudson@gmail.com,
Friends In Recovery,Monday,6:00 am,https://us04web.zoom.us/j/9498376643,Write to FriendsInRecoverySA@gmail.com for password,"Audio,Closed,Monday,Speaker,Telephone,Video",FriendsInRecoverySA@gmail.com,
Good Morning QTs,Monday,6:00 am,https://us02web.zoom.us/j/86175981326,ZOOM PHONE INFO: 1(312)626 6799,"Audio,LGBTQIAA+,Monday,Open,Telephone,Video",goodmorningqts@gmail.com,"16465588656,,83946348749#"
Life on Lifes Terms (Daily ABSI) - Lititz PA,Monday,6:00 am,https://us02web.zoom.us/j/83161140927,"No password required, waiting room enabled and please enter with video on.","Discussion,Monday,Open,Video",loltlititz@gmail.com,12678310333
Manic Monday,Monday,6:00 am,https://secularaa.org/on-line-meetings/,"One-tap : US: +16468769923,,515671255# or +16699006833,,515671255#","Loners / Isolationists,Monday,Open,Video",website@secularaa.net,
Michigan Dawn Patrol,Monday,6:00 am,https://zoom.us/j/86182108547,"Zoom Passcode, if any: 033240","Audio,Closed,Discussion,Monday,Video",michigandawnpatrol@gmail.com,3126266799
Mornings on McKinley Online,Monday,6:00 am,https://hrmsconsultingsolutions.my.webex.com/,"Passcode, if any: MOM7","Audio,Discussion,Monday,Open,Telephone,Video",aamckinleymornings@gmail.com,4084189388
On Awakening Group,Monday,6:00 am,https://us02web.zoom.us/j/81926448621,"Zoom Passcode, if any: 061520","Big Book,Discussion,Monday,Open,Speaker,Telephone,Video",weekdayonawakening@gmail.com,3017158592
Orchard Beach Group,Monday,6:00 am,https://zoom.us/my/orchard.beach?pwd=ZTNJMEp3Zlh4OXZ5bHhrR0g2RjdRZz09,Password : shells,"Audio,Big Book,Blind / Visually Impaired,Discussion,Monday,Open,Speaker,Telephone,Video",orchardbe@gmail.com,7813867680
Rise and Shine,Monday,6:00 am,https://zoom.us/j/781539323,Daily Reflections Meeting No password required - waiting room enabled.,"Audio,Discussion,Monday,Open,Video",pathfinders.recovery@gmail.com,3462487799
Shantytown Underground,Monday,6:00 am,https://us04web.zoom.us/j/6519854995,"Zoom Passcode, if any: shantytown","Audio,Big Book,Closed,Discussion,Monday,Speaker,Video",shantytownunderground@gmail.com,
Solon Log Cabin Annex,Monday,6:00 am,http://zoom.us/j/614403779,Sat-Sun: 453 146 323         http://zoom.us/j/453146323,"Audio,Closed,Discussion,Monday,Video",SolonlogcabinAnnex@gmail.com,
Solution Seekers Daily Online Meeting,Monday,6:00 am,https://us02web.zoom.us/w/9082684250,"Meeting Access Code, if any: 9082684250 PW sobriety","Audio,Monday,Open,Video",bikerat70@gmail.com,
SPB Sunrise,Monday,6:00 am,https://us02web.zoom.us/j/82578276459,"No Password required, waiting room enabled.","Audio,Discussion,Monday,Open,Telephone,Video",aa.sunrise@outlook.com,"13017158592,,,,82578276459#"
Sunrise Group,Monday,6:00 am,https://zoom.us/j/189313345,"Zoom Passcode, if any: 254510","Big Book,Closed,Discussion,Monday,Speaker,Video",srqsunrisegroup@gmail.com,
Sunshine at 7am,Monday,6:00 am,https://us02web.zoom.us/j/5093718130?pwd=LzZrRjRwUFJhaWpxLzFSZFpFNld5QT09,Meeting Access Code: Zoom: 509 371 8130 (Pin 442),"Audio,Closed,Discussion,Monday,Telephone,Video",support@sunshine7am.com,"3126266799,,509 371 8130"
Swenglish Lunch Meeting,Monday,6:00 am,https://zoom.us/j/4554487458,Web Site:  https://zoom.us/j/4554487458,"Monday,Swedish",,
The Early Cup of Sobriety,Monday,6:00 am,https://zoom.us/j/8826558373,"Public Email Contact, if any: info@tecos.group","Audio,Big Book,Closed,Discussion,Monday,Speaker,Telephone,Video",info@tecos.group,"9292056099,,,8826558373#"
Turning Point,Monday,6:00 am,https://us02web.zoom.us/j/5872468928,Password: AAToday,"Discussion,Monday,Open,Video",mwboston@gmail.com,"6178172015,,AAToday#"
Virtual Sunlight of the Spirit Group,Monday,6:00 am,https://us05web.zoom.us/j/86797480648?pwd=ZkswZWFuNDZERkloN1BhUXJlNnc2dz09,"Meeting Access Code, if any: rule62","Closed,Discussion,Monday,Video",virtualsunlightofspiritgroup@gmail.com,
Wake Up Call,Monday,6:00 am,https://us02web.zoom.us/j/8654737824?pwd=c3luWDJ3MnNiMlZYWTJqUTc0QzhsUT09,"We are the Wake Up Call Group of Alcoholics Anonymous. We adhere to the AA Traditions to the best of our ability. Our group has but one primary purpose-to carry its message to the alcoholic who still suffers. We do not endorse, finance, or lend the A.A. name to any related facility or outside enterprise, lest problems of money, property, and prestige divert us from our primary purpose.","Discussion,Monday,Open,Video",wakeupcall413@gmail.com,13017158592
Wake Up Call Daily Reflections,Monday,6:00 am,https://us02web.zoom.us/j/8654737824?pwd=c3luWDJ3MnNiMlZYWTJqUTc0QzhsUT09,"Public Email Contact, if any: wakeupcall413@gmail.com","Audio,Discussion,Monday,Open,Telephone,Video",wakeupcall413@gmail.com,"6465588656,,033259#"
WGAT Virtual - Discussion,Monday,6:00 am,https://zoom.us/j/886756436,www.wgatvirtual.com,"Audio,Discussion,Monday,Open,Video",info@wgatvirtual.com,
Women's Sober Living,Monday,6:00 am,,Email Contact: womensoberlivingus@gmail.com,"Audio,Closed,Discussion,Monday,Telephone,Women",womensoberlivingus@gmail.com,2029261201
Women's Sober LIving,Monday,6:00 am,,This meeting doesn’t accept anonymous phone calls.,"Closed,Monday,Telephone,Women",wsl7am@gmail.com,"2029261201,,,,192390#"
Happy Destiny Daily Women's,Monday,6:05 am,https://us02web.zoom.us/j/223188471?pwd=SUU1a0pjOE8rZTIxUXQzSm43Z1oxZz09,except every 2nd and 4th Sunday is a speaker meeting!,"Closed,Monday,Video",Happydestinygroup33@gmail.com,5864385747
