Name,Day,Time,Video,Desc,Categories,Email,Phone
AA Meeting Online,Friday,9:00 pm,http://www.aameetingonline.com,Dial: 1-224-501-3412 and when prompted to enter Meeting Id# 445-854-373,"Audio,Closed,Friday,Telephone,Video",bill@aameetingonline.com,"12245013412,,445-854-373"
AA Visionaries,Friday,9:00 pm,https://us04web.zoom.us/j/129878514,Stay for fellowship immediately following each meeting,"Audio,Friday,Open,Video",,
AAOL - Alcoholics Anonymous On Line,Friday,9:00 pm,,PLEASE EMAIL aanonol2020@gmail.com FOR LOG IN INFORMATION!,"Friday,LGBTQIAA+,Open,Video",aanonol2020@gmail.com,
Back to Basics,Friday,9:00 pm,https://us02web.zoom.us/j/3622583567?pwd=SWplZWlnVjI1MzVDTng1SGgycWI2dz09,"Meeting Access Code, if any: 1801","Audio,Big Book,Closed,Discussion,Friday,Telephone,Video",backtobasicsaameeting@gmail.com,"13462487799,,1801#"
Decompression Chamber,Friday,9:00 pm,https://us02web.zoom.us/j/3012613087?pwd=skVZOVRply9uVOdja2FBaGpjZGhOZz09,"Zoom Passcode, if any: sober","Discussion,Friday,Speaker,Video",aadecompressionchamber@gmail.com,
Friday Night Speakers Meeting,Friday,9:00 pm,https://us02web.zoom.us/j/84085567227,On-Line Meeting link Zoom Meeting ID 840 8556 7227,"Friday,Open,Speaker,Video",,
Gay Meetings Nightly,Friday,9:00 pm,https://www.gaymeetings.org,"An easy way to remember our meeting phone number, +1 (732) 352-3437, is that it spells ""READ LADIES"" on your phone's keypad. No meeting number or password is necessary—just dial and you will be connected.","Big Book,Closed,Discussion,Friday,LGBTQIAA+,Telephone",gaymeetings@yahoo.com,17323523437
Lincoln Group,Friday,9:00 pm,https://us02web.zoom.us/j/7811606886?pwd=ekhzNmMyZ3VJRW9oVTYxSHdtS0tlQT09,Password: 374682,"Audio,Big Book,Discussion,Friday,Open,Telephone,Video",lincolngroupaa@gmail.com,"6699006833,,7811606886"
Pee\Dee AA,Friday,9:00 pm,https://us04web.zoom.us/j/442521837,Open Discussion Meeting,"Audio,Big Book,Friday,Open,Video",windgapranch@gmail.com,
PG & Chill,Friday,9:00 pm,https://us02web.zoom.us/j/802496652,Password 960328,"Audio,Friday,Open,Telephone,Video",superdave1212@mac.com,"16699006833,,802496652"
Queer and Anonymous,Friday,9:00 pm,https://us02web.zoom.us/j/8970166221,Meeting ID: 897 0166 2212 Password: please email info.queerandanon@gmail.com,"Discussion,Friday,LGBTQIAA+,Open,Speaker,Telephone,Video,Young People",info.queerandanon@gmail.com,"16699009128,,89701662212#"
Rocklin Fellowship 7:00 pm Co-Ed Chairperson Meeting,Friday,9:00 pm,https://zoom.us/j/650793486,The password for all meetings is Rocklin.,"Friday,Open,Video",rocklinfwpaa@gmail.com,
Rule 62,Friday,9:00 pm,https://us02web.zoom.us/j/7161101728,"Public Email Contact, if any: hotasfirecrackers@gmail.com","Audio,Friday,Open,Speaker,Telephone,Video",rule62tooserious@gmail.com,
Sober Voices Group,Friday,9:00 pm,https://sites.google.com/site/aatelephonemeetings/home,"Sober Voices does not accept anonymous callers, use *82 to display your phone number.","Audio,Friday,Open",aatelephonemeetings@gmail.com,
Sobriety at night,Friday,9:00 pm,https://us02web.zoom.us/j/2012281985,All Are Welcome Beginners Topic Format Everyone Shares. Meeting Starts At 10:00 pm Eastern Time 7 Nights A Week,"Audio,Friday,Open,Video",sober.nights.nyc@gmail.com,
Solution on The Shore,Friday,9:00 pm,,Monday 8pm EST Big book speaker discussion https://zoom.us/j/591133821 | Password: 123092,"Audio,Friday,Open,Video",allaroundroofingman@gmail.com,
Spark of Hope,Friday,9:00 pm,http://zoom.us/j/6411641641,Call in by dialing +16699006833 or +14087403766 and punch in the info above,"Audio,Closed,Friday,Telephone,Video",sparkofhope164@gmail.com,16699006833
SPIRIT of the Universe,Friday,9:00 pm,https://us02web.zoom.us/j/77254042633,Passcode: 123123,"Big Book,Chat,Discussion,Email,Friday,Speaker,Telephone,Video",spiritoftheuniverse7@gmail.com,7052421130
Straight Pepper Diet,Friday,9:00 pm,,"Albuquerque, NM-based Friday Night Young People's Meeting, meeting virtually in the interim. Please email spdabqaa@gmail.com for further information.","Audio,Friday,Open,Video",spdabqaa@gmail.com,
Surrender To Win,Friday,9:00 pm,https://zoom.us/j/758893273,Email surrendertowin7pm@gmail.com.com for password,"Audio,Friday,Open,Telephone,Video",,"217394871,,366431#"
Tempe We Agnostics,Friday,9:00 pm,https://us02web.zoom.us/j/3921355847,Password    508344,"Discussion,Friday,Open,Secular,Video",weagnosticstempe@gmail.com,
This is Friday Night,Friday,9:00 pm,https://us02web.zoom.us/j/3295726827?pwd=WW4wYmZRT0tNNitGcURQUHh6MUFIQT09,"Web Site, if any: http://www.thisisfridaynight.com","Discussion,Friday,Open,Video,Young People",aafridaynight@gmail.com,
Vegas Drama Queens,Friday,9:00 pm,https://us04web.zoom.us/j/410592740,"ZOOM into our daily women's meeting, format varies daily","Audio,Discussion,Friday,Open,Video,Women",zoomintoaa@gmail.com,
VEGAS Life Changes at 7pm,Friday,9:00 pm,https://zoom.us/j/554496632,ZOOM in to Las Vegas with our VA friends and find LIFE CHANGES at 7PM PST every Friday Night! daily reflections discussion and all things life changing through Alcoholics Anonymous.,"Audio,Discussion,Friday,Open,Video",,
Waldport- willing to be free and hybrid,Friday,9:00 pm,https://us02web.zoom.us/j/483748921,No password required. Waiting room is enabled.,"Friday,Open,Video",plantsaremylife@outlook.com,
"Where there is a Will, there is a Way.",Friday,9:00 pm,http://zoom.us/j/354054276,"Meeting Access Code, if any: 354 054 276","Audio,Big Book,Discussion,Friday,Open,Telephone,Video",wherethereisawillthereisawayaa@gmail.com,"3854956261,,354054276#"
Women’s Nightly Book Study,Friday,9:00 pm,,Dial Telephone number (425) 436-6350   once prompted dial access code 770067# and you will be added to the conference call. After in conference Callers mute and unmute themselves by dialing *6,"Big Book,Closed,Friday,Telephone,Women",womensaabookstudy@gmail.com,"4254366350,,770067#"
10TH Step at 10:10 Group,Friday,9:10 pm,https://us02web.zoom.us/j/911097244,Meeting ID: 911 097 244,"Audio,Deaf / Hard of Hearing,Friday,Telephone,Video",tenthatten@gmail.com,"13017158592,,,,911097244#"
1 Hole In The Sky AA Meetings: West Valley Speaker Meeting,Friday,9:30 pm,https://zoom.us/j/514586368,Friday:  West Valley Speaker Meeting 7:30pm PST - Meeting ID: 514-586-368,"Audio,Friday,Open,Speaker,Video",holeinthesky.zoom@gmail.com,
Pacific Men's Stag Group of Alcoholics Anonymous,Friday,9:30 pm,https://us02web.zoom.us/w/363524221,"Meeting Access Code, if any: 041877","Audio,Closed,Friday,Men,Telephone,Video",pggolf@pggolf.org,
Twilight Zone,Friday,9:30 pm,https://us02web.zoom.us/j/224420335,"Public Email Contact, if any: twilightzonemeeting@gmail.com","Audio,Discussion,Friday,Open,Speaker,Video",twilightzonemeeting@gmail.com,
164 and Beyond - Online Meeting,Friday,10:00 pm,https://zoom.us/j/6775677559,Zoom Meeting ID: 677 567 7559,"Closed,Friday,Video",remotecommunities40@gmail.com,
AA After Hours,Friday,10:00 pm,https://us02web.zoom.us/j/2478907316,Email for a password: AHPword@gmail.com,"Friday,Open,Video",ahpword@gmail.com,
AA Afterdark 2.0,Friday,10:00 pm,https://us02web.zoom.us/j/2476101935,Website: http://afterdarkmeeting.com,"Audio,Friday,Open,Telephone,Video",afterdarkAA2.0@gmail.com,9292056099
AA Grant Us The Serenity (GUTS) - Friday,Friday,10:00 pm,https://zoom.us/j/3726634285?pwd=VHVsMXBIY2d4RzczMTZJODk2YXpWdz09,"Web Site, if any: https://www.aaguts.com","Audio,Big Book,Discussion,Friday,Open,Telephone,Video",room@aaguts.com,2532158782
AA Positive Alternatives,Friday,10:00 pm,https://us04web.zoom.us/j/77448062010,"Friday LGBTQ Support Group  (all AA and non-AA members welcome)  (8:00pm-9:30pm) This meeting will meet every Friday weekly to share positive experiences, knowledge and advise during their sobriety journey Please note a password is needed which will be provided to you by email.","Audio,Discussion,Friday,LGBTQIAA+,Open,Speaker,Video,Women,Young People",positivealternatives.voala2020@gmail.com,"5725196233,,12aa"
AA-Alive,Friday,10:00 pm,http://www.aa-alive.net/,Please note:  We do not verify attendance at meetings,"Chat,Discussion,Friday,Open,Steps / Traditions",Info@aa-alive.org,
Desperate As The Dying Can Be,Friday,10:00 pm,https://zoom.us/meeting/register/tJQpc-6hrTsre1m-f_YnWiPuJUh013Fm7Q,#: 669-900-9128 / PW: 904-479-301,"Audio,Big Book,Discussion,Friday,Open,Speaker,Telephone,Video",aa.mtgschedule@gmail.com,"6699009128,,904-479-301"
Freaky Friday,Friday,10:00 pm,https://us04web.zoom.us/j/2835953698?pwd=V1NDdXU0OUFJcjUxZjVoWENKMStRZz09,"Zoom Passcode, if any: love","Audio,Discussion,Friday,Open,Speaker,Video",radfordhall4343@gmail.com,
Hour 22,Friday,10:00 pm,https://us02web.zoom.us/j/89364734158,Meetings begin with a topic brought from any conference-approved AA Literature. The host will call on people for sharing. Shares are 3 minutes. Please limit your sharing to your experience with alcoholism as it relates to the topic of the meeting. All voices are welcome here.,"Big Book,Discussion,Friday,Open,Video",hour22atx@gmail.com,
Moral Inventory,Friday,10:00 pm,,This meeting works well for travelers and the two separate meetings in one day allow for room to mindfully meditate inbetween. There is no leader at this meeting.,"Audio,Closed,Friday,Telephone",maryheal33@gmail.com,"6417150861,,550593"
Recovery Journey,Friday,10:00 pm,http://secondlife.com/,barbara.j.knight@gmail.com,"Chat,Friday,Game,Open",barbara.j.knight@gmail.com,
Serenity Lives Matter,Friday,10:00 pm,https://us02web.zoom.us/j/8642019585,OPEN ALCOHOLICS ANONYMOUS MEETING ON BEGINNERS TOPIC SEVEN DAYS A WEEK.,"Audio,Chat,Friday,Open,Video",sober.nights.nyc@gmail.com,
Sicker than Most,Friday,10:00 pm,https://us02web.zoom.us/j/4971976605,Email Contact: sicker.than.mostaa@gmail.com,"Audio,Discussion,Friday,Open,Video",sicker.than.mostaa@gmail.com,
The Village Group,Friday,10:00 pm,https://zoom.us/j/7557103078,"Zoom Passcode, if any: 210254","Audio,Discussion,Friday,Open,Video",thevillagegroup@mail.com,
THERE IS A SOLUTION,Friday,10:00 pm,https://zoom.us/j/251046515,"Zoom Passcode, if any: 031509","Big Book,Discussion,Friday,Open,Speaker,Video",thereisasolutionaa1@gmail.com,6465687788
Worldwide Primary Purpose Group,Friday,10:00 pm,https://zoom.us/j/759556794?fbclid=IwAR1o3osJ_0e-3MEPtA9-nTVJzN1yH_wQIHTiFe5F3tdH3ippEpArXzFL8SA,"10:00 PM CST  12 & 12 - An in-depth  look at our other text, the 12 & 12","Audio,Closed,Friday,Video,Women",wwppg@yahoo.com,
What's The Point! A Very Studious Big Book Study,Friday,10:15 pm,https://zoom.us/j/104268130,"Zoom Passcode, if any: 707","Audio,Big Book,Discussion,Friday,Open,Telephone,Video",wtpbigbookstudy@gmail.com,"6699009128,,,,104268130"
Beach Meeting - A Dubai Based Meeting,Friday,10:30 pm,https://us02web.zoom.us/j/86502942403,"Zoom Passcode, if any: 412437","Audio,Friday,Open,Speaker,Video",beachmeetingdubai@gmail.com,
Sober AF,Friday,10:30 pm,https://us02web.zoom.us/j/84752821258,No password. Waiting room enabled.,"Audio,Friday,Open,Video",soberaf209@gmail.com,
Sobriety at night,Friday,10:30 pm,https://us02web.zoom.us/j/2012281985,Open To All Sobriety At Night Meets 7 Nights At 11:30 pm Eastern Time,"Audio,Friday,Open,Video",sober.nights.nyc@gmail.com,
The 4th Dimension Group of Alcoholics Anonymous,Friday,10:30 pm,https://us05web.zoom.us/j/87059714652,Zoom Passcode is: Driars,"Audio,Big Book,Friday,Open,Speaker,Video",reno4thdimension@gmail.com,
Vegas Virtual Venice Beach,Friday,10:30 pm,https://us04web.zoom.us/j/554893205,ZOOM in to our VEGAS Virtual Venice Beach meeting Friday Nights at 8:30PM,"Audio,Discussion,Friday,Open,Video",zoomintoaa@gmail.com,
9pm Nightly Discussion Meeting,Friday,11:00 pm,https://us02web.zoom.us/j/815892671266,Friday—Open Discussion,"Big Book,Deaf / Hard of Hearing,Discussion,Friday,LGBTQIAA+,Open,Video",nightlydiscussionaa@gmail.com,
AA After Hours,Friday,11:00 pm,https://us02web.zoom.us/j/2478907316,Email for a password: AHPword@gmail.com,"Friday,Open,Video",ahpword@gmail.com,
AA Afterdark 2.0,Friday,11:00 pm,https://us02web.zoom.us/j/2476101935,Website: http://afterdarkmeeting.com,"Audio,Friday,Open,Telephone,Video",afterdarkAA2.0@gmail.com,9292056099
AA Grant Us The Serenity (GUTS) - Friday,Friday,11:00 pm,https://zoom.us/j/3726634285?pwd=VHVsMXBIY2d4RzczMTZJODk2YXpWdz09,"Web Site, if any: https://www.aaguts.com","Audio,Big Book,Discussion,Friday,Open,Telephone,Video",room@aaguts.com,2532158782
AAOnline Global Chat,Friday,11:00 pm,http://aaonline.org,Learn more about us at: aaonline.org,"Big Book,Chat,Discussion,Friday,Open,Speaker",ttsoberalcoholic@aaonline.org,
CROSS TALK GROUP,Friday,11:00 pm,,Passcode: 979634#,"Audio,Friday,Open,Telephone",peter@coolasstuff.com,"7124510235,,979634#"
Crosstalk Meeting of AA,Friday,11:00 pm,http://www.freeconferencecall.com/wall/bftgog1986/,Sun PM / Mon AM: Daily Reflections,"Audio,Big Book,Blind / Visually Impaired,Discussion,Friday,Open,Speaker,Telephone",aa.crosstalk.mtg@gmail.com,"7124510235,,,,979634#"
Friday Night Candlelight,Friday,11:00 pm,https://us02web.zoom.us/j/115393718?,Write to: Fridaycandlelight@gmail.com for the password,"Audio,Discussion,Friday,Open,Video",Fridaycandlelight@gmail.com,
Lambda Dallas AA Children of the Corn Meeting,Friday,11:00 pm,https://zoom.us/j/827282878,https://lambdadallas.org/,"Closed,Discussion,Friday,LGBTQIAA+,Video",,
Moonlight Meeting,Friday,11:00 pm,https://us02web.zoom.us/j/6287959814,"Zoom Passcode, if any: 58201","Audio,Chat,Friday,Open,Video,Young People",agudvangen87@gmail.com,
"No Fees, No Dues",Friday,11:00 pm,https://meet.jit.si/247recovery,"It is encouraged that a structured meeting begins 3 times a day, at 0700, 1500 and 2300. The meeting before the meeting and after the meeting can expand to fill the day :)","Audio,Closed,Friday,Telephone,Video",nofeesnodues@gmail.com,
Principles Before Pandemic (Pb4P),Friday,11:00 pm,https://us02web.zoom.us/j/94496270330,Email Principlesbe4pandemic@gmail.com for password.,"Audio,Closed,Discussion,Friday,Speaker,Video",Principlesbe4pandemic@gmail.com,
SERENITY~LIVES~MATTER,Friday,11:00 pm,https://us04web.zoom.us/j/79627919344,"Zoom Passcode, if any: SLM","Big Book,Discussion,Friday,Open,Video",SERENITYLIVESMATTER@OUTLOOK.COM,7703224343
Transgender Unity Speaker,Friday,11:00 pm,https://us04web.zoom.us/j/73364311846?pwd=M2R4VTlVd0VhWG56OG9ZQUNURmJqQT09,"Meeting Access Code, if any: LGBTQ","Friday,LGBTQIAA+,Open,Speaker,Video",transgenderunity2020@gmail.com,2402842539
When We Retire At Night,Friday,11:00 pm,https://zoom.us/j/954469573,Zoom: https://us02web.zoom.us/j/954469573,"Audio,Friday,Open,Video",whenweretireatnightaa@gmail.com,
11:11 Candlelight Meeting,Friday,11:11 pm,https://www.1111candlelight.org/,"Come join us for a relaxing end to your day at the 11:11 Candlelight Meeting.  We meet every night so come join us as we share our experience, strength & hope with one another!  All are welcome!  We open the meeting early & stay late for fellowship & laughter.","Discussion,Friday,Open,Video",Candlelightmeeting2020@gmail.com,
AA Afterdark 2.0,Friday,11:59 pm,https://us02web.zoom.us/j/2476101935,Website: http://afterdarkmeeting.com,"Audio,Friday,Open,Telephone,Video",afterdarkAA2.0@gmail.com,9292056099
AA - Thailand Sobriety Group Online,Saturday,12:00 am,https://us04web.zoom.us/j/984312014,Sunday: Living Sober Reading w/ Discussion,"Audio,Discussion,Open,Saturday,Video",aabrconline@gmail.com,
AA Grant Us The Serenity (GUTS) - Friday,Saturday,12:00 am,https://zoom.us/j/3726634285?pwd=VHVsMXBIY2d4RzczMTZJODk2YXpWdz09,"Web Site, if any: https://www.aaguts.com","Audio,Big Book,Discussion,Open,Saturday,Telephone,Video",room@aaguts.com,2532158782
An all night place,Saturday,12:00 am,https://us02web.zoom.us/j/2021096262,PW: Rule62,"Audio,Open,Saturday,Secular,Video",anallnightplace@gmail.com,
"BBG Monday Open
Participation Candlelight",Saturday,12:00 am,,only): 566938,"Audio,Open,Saturday,Telephone,Video",thebbgaa@gmail.com,6699006833
Hawaii Online Meetings,Saturday,12:00 am,https://zoom.us/j/5455786334?pwd=S3F6K1hyWkhsMENJWFRQNnV6eW9tZz09,"+13462487799,,5455786334# US (Houston)","Audio,Open,Saturday,Telephone,Video",hawaiionlinemeetings@gmail.com,"13462487799,,5455786334"
LAST CALL,Saturday,12:00 am,https://us02web.zoom.us/j/84274705712?pwd=clBzL0NVb1FySUVrSzkxcVY1RVJKdz09,This meeting occurs nightly @ 10pm PST,"Discussion,Open,Saturday,Speaker,Video",lastcall@gmail.com,16699009128
Last stop,Saturday,12:00 am,https://us04web.zoom.us/j/3954623725,Late night meeting for alcoholics that are up late at night. Email for password: Masterjs528@hotmail.com,"Open,Saturday,Video",Masterjs528@hotmail.com,
Radford Zombies,Saturday,12:00 am,https://us04web.zoom.us/j/2835953698,http://radfordonline.com,"Audio,Discussion,Open,Saturday,Speaker,Video",radfordhall4343@gmail.com,
Sick and Twisted 3,Saturday,12:00 am,https://us02web.zoom.us/j/9318684655?pwd=TmRUeTlzWUZnVk9ZcmFnNHd2N05Pdz09,Meeting ID: 931-868-4655  Passcode: 96815,"Discussion,Newcomer,Open,Saturday,Video,Young People",SICKANDTWISTEDTOOONLINE@GMAIL.COM,
The Acid Test,Saturday,12:00 am,https://zoom.us/j/537542397,"Meeting times are 12 noon, 6:00 pm and 10:00 pm MST (Phoenix AZ time). Please note that Arizona does not observe daylight savings time, so between March 14th and November 7th 2021, Arizona is on PST","Audio,LGBTQIAA+,Open,Saturday,Video",AAAcidTest@gmail.com,16699009128
The Unshakable Foundation,Saturday,12:00 am,https://us02web.zoom.us/j/8062584353,Open online meeting of Alcoholics Anonymous. Nightly at 10pm pacific time. One hour long topic meeting. Waiting room enabled.,"Audio,Big Book,Discussion,Open,Saturday,Telephone,Video",theunshakablefoundation@gmail.com,3126266799
VEGAS Deliver us From Ego,Saturday,12:00 am,https://nyintergroup.zoom.us/j/576015340,Public contact email zoomintoaa@gmail.com,"Audio,Open,Saturday,Video",zoomintoaa@gmail.com,
Ohua Group,Saturday,12:30 am,https://us02web.zoom.us/j/388665002,Sun = 7:30 PM (HST) - Big Book Study,"Audio,LGBTQIAA+,Open,Saturday,Video",ohuagroup@gmail.com,6999006833
AA Daily Meditation Meeting,Saturday,1:00 am,https://us04web.zoom.us/j/4706538587#success,"Web Site, if any: http://www.aageneva.org/","Closed,Meditation,Saturday,Video",aadailymeditation@gmail.com,
AA Grant Us The Serenity (GUTS) - Friday,Saturday,1:00 am,https://zoom.us/j/3726634285?pwd=VHVsMXBIY2d4RzczMTZJODk2YXpWdz09,"Web Site, if any: https://www.aaguts.com","Audio,Big Book,Discussion,Open,Saturday,Telephone,Video",room@aaguts.com,2532158782
Eusta-Baphalus,Saturday,1:00 am,,"The Eusta-Baphalus Group is an Open AA mtg & a SafePlace for LGBTQ+ people; we meet 3 nights weekly @11pm Pacific time, Mondays, Tuesdays and Fridays.","LGBTQIAA+,Open,Saturday,Telephone",,"7124323900,,102392#"
Hawaii AA Ohana,Saturday,1:00 am,https://us02web.zoom.us/j/2839146879,"Meeting Access Code, if any: 283 914 6879","Closed,Discussion,Saturday,Speaker,Video",hawaiiaaohana@gmail.com,"8084219764,,2839146879#"
Rule 62,Saturday,1:00 am,https://us02web.zoom.us/j/6376057627,"Zoom Passcode, if any: Rule62","Closed,Men,Saturday,Video",,
AA 24 Godziny,Saturday,2:00 am,,PW: Coffee,"Audio,Closed,Saturday,Video",AA_24hours-owner@yahoogroups.com,
AA Grant Us The Serenity (GUTS) - Saturday,Saturday,2:00 am,https://zoom.us/j/3726634285?pwd=VHVsMXBIY2d4RzczMTZJODk2YXpWdz09,"Web Site, if any: https://www.aaguts.com","Audio,Big Book,Discussion,Open,Saturday,Telephone,Video",room@aaguts.com,2532158782
Midnight Howlers of San Diego,Saturday,2:00 am,https://us02web.zoom.us/j/6663059874?pwd=REFpS2dLM2tIcGtEUXpHcjFvUFRZQT09,We ask that you support & respect others in the meeting. We look forward to meeting you as we zoom the road of happy destiny! Court Verification requests can be sent to midnighthowlerssd@gmail.com,"Big Book,Discussion,Open,Saturday,Video",midnighthowlerssd@gmail.com,
Primary Purpose Speaker Meeting,Saturday,2:00 am,https://us02web.zoom.us/j/2221642222,"Zoom Passcode, if any: 164","Audio,Open,Saturday,Speaker,Video",primary.purpose.fellowship@gmail.com,5714375832
Recovery in da House,Saturday,2:00 am,https://zoom.us/j/8784692945,"Meeting Access Code, if any: staysober","Big Book,Closed,Discussion,Saturday,Video",recoveryindahouse@gmail.com,
Vegas PANDEMIC! at the disco,Saturday,2:00 am,https://us04web.zoom.us/j/722570166,"rotating through daily reflections, burning desires and various meditations.","Audio,Discussion,Open,Saturday,Video",zoomintoaa@gmail.com,
AA Grant Us The Serenity (GUTS) - Saturday,Saturday,3:00 am,https://zoom.us/j/3726634285?pwd=VHVsMXBIY2d4RzczMTZJODk2YXpWdz09,"Web Site, if any: https://www.aaguts.com","Audio,Big Book,Discussion,Open,Saturday,Telephone,Video",room@aaguts.com,2532158782
Agneswater Bigbook Study or Topic,Saturday,3:00 am,,"Zoom Passcode, if any: billw","Audio,Big Book,Chat,Discussion,Open,Saturday,Video",jlynch1967@hotmail.com,
Shivering Denizens Daily Insomniac,Saturday,3:00 am,https://us02web.zoom.us/j/87232950952,"Zoom Passcode, if any: 151","Audio,Open,Saturday,Video",shivdenaa@gmail.com,
Get up shut up in silent meditation,Saturday,4:00 am,https://us04web.zoom.us/j/4248226111,"No password required, waiting room enabled.","Open,Saturday,Video",gusuism@gmail.com,
GUSU 1 Get Up Shut Up,Saturday,4:00 am,https://us02web.zoom.us/j/4248226111,"International Silent Meditation meeting of Alcoholics Anonymous open to all where we hope through readings, a twenty minute meditation and fellowship to expand our conscious contact with God, realise a greater freedom from the bondage of self and share emotional sobriety.","Open,Saturday,Video",gusuism@gmail.com,
Southern Cross AA Group,Saturday,4:00 am,http://www.southerncrossaa.blogspot.com,"8pm daily (Sydney, Australia, time zone) on PalTalk: select the Southern Cross AA Meeting Group Group to join.","Open,Saturday,Video",janishirst@gmail.com,
Fourth Dimension Prayer & Meditation AA,Saturday,4:15 am,https://us04web.zoom.us/j/89136475364,https://fourthdimensionaa.weebly.com,"Audio,Closed,Discussion,Meditation,Saturday,Video",4thdimensionmtg@gmail.com,
@ AA Aussie Recovery,Saturday,4:30 am,https://aaaussieaa.wixsite.com/skype,Email - brianedwardo@gmail.com,"Audio,Open,Saturday,Video",brianedwardo@gmail.com,
AA-12 Step Daily Workout,Saturday,5:00 am,https://us02web.zoom.us/j/6188402098,Eastern Standard Time,"Big Book,Closed,Saturday,Video",AADaily12StepWorkout@gmail.com,
Crazy Monkey AA Group,Saturday,5:00 am,https://zoom.us/j/87594927269,"Meeting Access Code, bahalana","Discussion,Open,Saturday,Video",,
Serenity Lives Matter,Saturday,5:00 am,https://us02web.zoom.us/j/8642019585,Open AA Meeting. Beginners Topic. No passcode required.,"Audio,Chat,Open,Saturday,Video",sober.nights.nyc@gmail.com,
AA-Australia Unity Recovery Group,Saturday,5:30 am,https://www.aa-oztralia.net,"9:30pm daily (Sydney, Australia, time zone) on PalTalk: to join find and select the AA-Australia Unity Recovery Group.","Audio,Open,Saturday,Video",,
Sober Start,Saturday,5:30 am,https://us02web.zoom.us/j/82515305518?pwd=TXYvV3pMdVhRRHlUQ3FBa2ZaN1pTZz09,"Public Email Contact, if any: soberstartsc@gmail.com","Big Book,Closed,Discussion,Open,Saturday,Speaker,Video",soberstartsc@gmail.com,
Sunrise Sobriety,Saturday,5:30 am,https://us02web.zoom.us/j/6594524780,Sat for a Big Book meeting,"Audio,Closed,Saturday,Telephone,Video",sunrise.sobriety1@gmail.com,6468769923
Morning Meditation,Saturday,5:45 am,https://us02web.zoom.us/j/718456934,Zoom ID:  718 456 934,"Audio,Closed,Discussion,Saturday,Video",,
#TooEarlyForWorry,Saturday,6:00 am,https://us02web.zoom.us/j/82407422844,"Zoom Passcode, if any: 01112020","Big Book,Discussion,Open,Saturday,Video",tooearlyforworry@gmail.com,13126266799
AA Thailand International Meeting,Saturday,6:00 am,https://zoom.us/j/83379145171,ZOOM Link:  https://zoom.us/j/83379145171   password:  335155,"Closed,Discussion,Saturday,Speaker,Video",,
Big Book Step Study Meeting (India),Saturday,6:00 am,https://meet.google.com/wdj-ghza-yuv,Big Book Study group,"Audio,Big Book,Saturday",bigbookstudy21@gmail.com,917875872077
Dawn Patrol On-Line,Saturday,6:00 am,https://us02web.zoom.us/j/85499148139,Zoom Meeting ID 854-9914-8139; Password 563826,"Audio,Open,Saturday,Telephone,Video",Dpatrolinfo@gmail.com,13017158592
Day Opener's Online,Saturday,6:00 am,https://us02web.zoom.us/j/86562427482,Meeting ID: 865 6242 7482,"Audio,Big Book,Discussion,Open,Saturday,Speaker,Video",aleesali0311@gmail.com,"13017158592,,86562427482#"
Day Openers Group,Saturday,6:00 am,https://us02web.zoom.us/j/84646826412,Passcode: stay,"Audio,Open,Saturday,Video",dayopenersgrp@gmail.com,
Friends In Recovery,Saturday,6:00 am,https://us04web.zoom.us/j/9498376643,Write to FriendsInRecoverySA@gmail.com for password,"Audio,Closed,Saturday,Speaker,Telephone,Video",FriendsInRecoverySA@gmail.com,
Good Morning QTs,Saturday,6:00 am,https://us02web.zoom.us/j/86175981326,ZOOM PHONE INFO: 1(312)626 6799,"Audio,LGBTQIAA+,Open,Saturday,Telephone,Video",goodmorningqts@gmail.com,"16465588656,,83946348749#"
Life on Lifes Terms (Daily ABSI) - Lititz PA,Saturday,6:00 am,https://us02web.zoom.us/j/83161140927,"No password required, waiting room enabled and please enter with video on.","Discussion,Open,Saturday,Video",loltlititz@gmail.com,12678310333
Men In Recovery Without Borders,Saturday,6:00 am,https://us02web.zoom.us/j/7458537642,http://mirwb.com/,"Men,Open,Saturday,Video",joedemitruk@gmail.com,"5619268846,,7458537642#"
Mornings on McKinley Online,Saturday,6:00 am,https://hrmsconsultingsolutions.my.webex.com/,"Passcode, if any: MOM7","Audio,Discussion,Open,Saturday,Telephone,Video",aamckinleymornings@gmail.com,4084189388
On Awakening Group,Saturday,6:00 am,https://us02web.zoom.us/j/81926448621,"Zoom Passcode, if any: 061520","Big Book,Discussion,Open,Saturday,Speaker,Telephone,Video",weekdayonawakening@gmail.com,3017158592
Rise and Shine,Saturday,6:00 am,https://zoom.us/j/781539323,Daily Reflections Meeting No password required - waiting room enabled.,"Audio,Discussion,Open,Saturday,Video",pathfinders.recovery@gmail.com,3462487799
